{
  "documentType": "d2p:validation-rule-definition",
  "schemaVersion": "1.0.0",
  "ruleId": "d2p:extensions-supported",
  "version": "1.0.0",
  "title": "Extensions are declared and supported",
  "description": "Every extension feature type used by a pattern has exactly one matching feature capability, and no extension block or feature type that requires rejection is left unsupported.",
  "layer": "domain",
  "targetDocumentTypes": [
    "d2p:artifact",
    "d2p:benchmark-run",
    "d2p:body-measurement-profile",
    "d2p:capabilities",
    "d2p:command",
    "d2p:command-receipt",
    "d2p:conformance-case",
    "d2p:evaluation-request",
    "d2p:event",
    "d2p:export-scene-2d",
    "d2p:fit-evaluation-report",
    "d2p:fit-profile",
    "d2p:fixture-manifest",
    "d2p:garment-measurement-spec",
    "d2p:gate-evaluation",
    "d2p:geometry-snapshot",
    "d2p:grading-rule-set",
    "d2p:mapping-profile",
    "d2p:measurement-definition-registry",
    "d2p:pattern",
    "d2p:pattern-evaluation",
    "d2p:print-job-spec",
    "d2p:product",
    "d2p:project",
    "d2p:quality-evidence-bundle",
    "d2p:relationship",
    "d2p:revision",
    "d2p:size-system",
    "d2p:test-run-report",
    "d2p:tolerance-profile",
    "d2p:validation-profile",
    "d2p:validation-report",
    "d2p:validation-rule-definition",
    "d2p:waiver"
  ],
  "defaultSeverity": "error",
  "diagnosticCodes": [
    "D2P-SEM-005",
    "D2P-SEM-006"
  ],
  "deterministic": true,
  "requiresEvaluator": false
}
