{
  "documentType": "d2p:validation-rule-definition",
  "schemaVersion": "1.0.0",
  "ruleId": "d2p:contour-simple",
  "version": "1.0.0",
  "title": "Contours are simple",
  "description": "No contour or closed scene path intersects or overlaps itself, and no two edges of a piece reuse the same curve feature. The conformance runners check line-only contours and paths; evaluators extend the check to curves.",
  "layer": "derived",
  "targetDocumentTypes": [
    "d2p:export-scene-2d",
    "d2p:geometry-snapshot",
    "d2p:pattern"
  ],
  "defaultSeverity": "error",
  "diagnosticCodes": [
    "D2P-SEM-011",
    "D2P-SEM-013"
  ],
  "deterministic": true,
  "requiresEvaluator": false
}
